{
  "$schema": "https://json-schema.org/draft/2020-12/schema",
  "$id": "urn:touchline:contract:published-course.v1",
  "type": "object",
  "properties": {
    "format": {
      "const": "touchline-snapshot"
    },
    "version": {
      "const": 1
    },
    "curriculum": {
      "$ref": "urn:touchline:contract:public-curriculum.v1"
    },
    "progress": {
      "$ref": "urn:touchline:contract:public-progress.v1"
    },
    "status": {
      "enum": [
        "active",
        "paused",
        "completed",
        "saved"
      ]
    },
    "revision": {
      "type": "integer",
      "minimum": 0,
      "maximum": 9007199254740991
    },
    "publishedAt": {
      "type": "string",
      "pattern": "^\\d{4}-\\d{2}-\\d{2}T\\d{2}:\\d{2}:\\d{2}(?:\\.\\d{1,3})?Z$"
    }
  },
  "required": [
    "format",
    "version",
    "curriculum",
    "progress",
    "status",
    "revision",
    "publishedAt"
  ],
  "additionalProperties": false
}
